{"dataset": {"slug": "synthetic-morph-test", "version": "0.1.0"}, "edition_id": "test-edition-min", "synthetic_test_only": true, "analyses": [{"surah": 2, "ayah": 1, "token_position": 1, "analysis_index": 0, "surface": "", "lemma": "كَتَبَ", "root": "كتب", "stem": "كتب", "pos_unified": "Verb", "pos_native": "V_perf", "features_json": {}, "segments": [], "provenance_layer": "B", "algorithm": "", "algorithm_version": "", "confidence": null, "reviewer": "", "status": "imported"}]}
