{"dataset": {"slug": "synthetic-morph-test", "version": "0.1.0"}, "edition_id": "test-edition-min", "synthetic_test_only": true, "analyses": [{"surah": 2, "ayah": 1, "token_position": 1, "analysis_index": 0, "surface": "كِتَاب", "lemma": "كِتَاب", "root": "   ", "stem": "كتاب", "pos_unified": "Noun", "pos_native": "N", "features_json": {}, "segments": [], "provenance_layer": "B", "algorithm": "", "algorithm_version": "", "confidence": null, "reviewer": "", "status": "imported"}]}
