{"dataset": {"slug": "synthetic-morph-test", "version": "0.1.0"}, "edition_id": "test-edition-min", "synthetic_test_only": true, "analyses": [{"surah": 2, "ayah": 1, "token_position": 1, "analysis_index": 0, "surface": "يَعْلَمُ", "lemma": "عَلِمَ", "root": "علم", "stem": "يعلم", "pos_unified": "Verb", "pos_native": "V_impf", "features_json": {}, "segments": [], "provenance_layer": "D", "algorithm": "synthetic-tagger", "algorithm_version": "0.0.0-test", "confidence": 1.5, "reviewer": "", "status": "imported"}]}
